visit_id,ship_id,name_as_written,date_from,date_to,date_confidence,anchorage,region,flag,flag_basis,purpose,outcome,visit_type,n_records,excerpt,citations,sources_disagree,status
,santiago,Santiago,1775-03-16,1775-03-16,exact,San Blas,baja,spain,stated,exploration,departed,port-call,1,"Departed San Blas 16 Mar 1775: Santiago (Hezeta), Sonora, San Carlos — the Bucareli expedition vs Russian encroachment","[{""type"": ""published-primary"", ""ref"": ""Sierra, 'Account of the Hezeta Expedition' (1930, CHSQ 9:3, ed. Wagner)"", ""note"": ""Departed San Blas 16 Mar 1775: Santiago (Hezeta), Sonora, San Carlos — the Bucareli expedi""}]",,reviewed
,sonora,Sonora,1775-03-16,1775-03-16,exact,San Blas,baja,spain,stated,exploration,departed,port-call,1,Departed San Blas with the Santiago; Ayala then Bodega y Quadra commanding,"[{""type"": ""published-primary"", ""ref"": ""Sierra, 'Account of the Hezeta Expedition' (1930, CHSQ 9:3, ed. Wagner)"", ""note"": ""Departed San Blas with the Santiago; Ayala then Bodega y Quadra commanding""}]",,reviewed
,santiago,Santiago,1775-06-09,1775-06-19,exact,Trinidad,alta,spain,stated,exploration,arrived,port-call,1,Anchored Trinidad Bay 9 June (first European contact with the Yurok at Tsurai); possession ceremony on Trinidad Head 11 ,"[{""type"": ""published-primary"", ""ref"": ""Sierra, 'Account of the Hezeta Expedition' (1930, CHSQ 9:3, ed. Wagner)"", ""note"": ""Anchored Trinidad Bay 9 June (first European contact with the Yurok at Tsurai); possession""}]",,reviewed
,sonora,Sonora,1775-06-09,1775-06-19,exact,Trinidad,alta,spain,stated,exploration,arrived,port-call,1,"The Sonora found the anchorage 9 June; shared the Trinidad possession, watering, and the Tortolas excursion","[{""type"": ""published-primary"", ""ref"": ""Sierra, 'Account of the Hezeta Expedition' (1930, CHSQ 9:3, ed. Wagner)"", ""note"": ""The Sonora found the anchorage 9 June; shared the Trinidad possession, watering, and the T""}]",,reviewed
,santiago,Santiago,1775-10-07,1775-10-07,exact,Monterey,alta,spain,stated,exploration,arrived,port-call,1,The ships reunited at Monterey 7 Oct 1775 after the northern cruises (Hezeta to 49°; the Sonora to 58°),"[{""type"": ""published-primary"", ""ref"": ""Sierra, 'Account of the Hezeta Expedition' (1930, CHSQ 9:3, ed. Wagner)"", ""note"": ""The ships reunited at Monterey 7 Oct 1775 after the northern cruises (Hezeta to 49°; the S""}]",,reviewed
,sonora,Sonora,1775-10-07,1775-10-07,exact,Monterey,alta,spain,stated,exploration,arrived,port-call,1,"Bodega y Quadra rejoins at Monterey, 7 Oct 1775","[{""type"": ""published-primary"", ""ref"": ""Sierra, 'Account of the Hezeta Expedition' (1930, CHSQ 9:3, ed. Wagner)"", ""note"": ""Bodega y Quadra rejoins at Monterey, 7 Oct 1775""}]",,reviewed
,(unnamed vessel),,1793,1793,year,Trinidad,alta,spain,attested/inferred,exploration,arrived,port-call,1,"Martinez y Zayas surveyed/charted Trinidad Bay, 1793 (his chart reproduced in Wagner's ed., p. 219) — VESSEL NAME PENDIN","[{""type"": ""published-primary"", ""ref"": ""Sierra, 'Account of the Hezeta Expedition' (1930, CHSQ 9:3, ed. Wagner)"", ""note"": ""Martinez y Zayas surveyed/charted Trinidad Bay, 1793 (his chart reproduced in Wagner's ed.""}]",,reviewed
