visit_id,ship_id,name_as_written,date_from,date_to,date_confidence,anchorage,region,flag,flag_basis,purpose,outcome,visit_type,n_records,excerpt,citations,sources_disagree,status
v0775,(unnamed vessel),,1810-07-12,1810-07-12,exact,,alta,,,,,unlocated,1,Provided aid to the schooner '[del Rey] / la Moscú[?].',"[{""type"": ""ca-record"", ""ca"": ""12"", ""doc"": ""331"", ""scan"": ""n278"", ""url"": ""https://archive.org/details/168036075_79_14/page/n278""}]",,draft
v0776,(unnamed vessel),,1810-09-19,1810-09-19,exact,,alta,,,otter,,unlocated,1,Otter-fishing canoes: ~20+ fishing canoes sighted heading to the San José esteros (up to 22); SF Christian Indians repor,"[{""type"": ""ca-record"", ""ca"": ""12"", ""doc"": ""332"", ""scan"": ""n278–n279"", ""url"": ""https://archive.org/details/168036075_79_14/page/n278""}]",,draft
v0777,(unnamed vessel),,1810-10-03,1810-10-03,exact,Bodega,alta,russia,stated,otter,,port-call?,1,"Moraga's overland-naval reconnaissance diary, Bodega, 23 Sep–2 Oct 1810: at the estero de S.n Juan Fran.co, Indians repo","[{""type"": ""ca-record"", ""ca"": ""12"", ""doc"": ""332b"", ""scan"": ""n279–n282"", ""url"": ""https://archive.org/details/168036075_79_14/page/n279""}]",,draft
v0778,alexander,Alexander,1810-10-09,1810-10-09,exact,,alta,usa,stated,otter,seized,unlocated,1,Otter-fishing: the skins confiscated from the American frigate *Alexander* were rotten (dumped at sea); CA vecinos may c,"[{""type"": ""ca-record"", ""ca"": ""12"", ""doc"": ""344"", ""scan"": ""n294"", ""url"": ""https://archive.org/details/168036075_79_14/page/n294""}]",,draft
v0779,princesa,Princesa,1810-10-17,1810-10-26,exact,,alta,usa,stated,,deserters,unlocated,2,Octubre 26 (pp.384-86): que dispuso se embarque José de la Guerra y Noriega por haber salido [electo] habilitado Gral. e,"[{""type"": ""ca-record"", ""ca"": ""12"", ""doc"": ""336"", ""scan"": ""n286"", ""url"": ""https://archive.org/details/168036075_79_14/page/n286""}, {""type"": ""ca-record"", ""ca"": ""25"", ""doc"": ""40"", ""scan"": ""n378"", ""url"": ""https://archive.org/details/168036074_80_7_2/page/n378""}]",,draft
v0780,princesa,Princesa,1810-10-22,1810-10-22,exact,Monterey,alta,spain,attested/inferred,,,port-call?,1,"Hemp embarked on the *Princesa* for San Diego (19th): 1618 arrobas + Monterey's 181 = 3,820 arrobas.","[{""type"": ""ca-record"", ""ca"": ""12"", ""doc"": ""338"", ""scan"": ""n287"", ""url"": ""https://archive.org/details/168036075_79_14/page/n287""}]",,draft
v0781,(unnamed vessel),,1810-11-26,1810-11-26,exact,,alta,usa,stated,,,unlocated,1,Tte. Estudillo arrived the 23rd reporting 13 fishing canoes counted from the S.n Mateo esteros to S.n Bruno — up to 20 t,"[{""type"": ""ca-record"", ""ca"": ""12"", ""doc"": ""332c"", ""scan"": ""n282–n283"", ""url"": ""https://archive.org/details/168036075_79_14/page/n282""}]",,draft
v0782,princesa,Princesa,1810-12-03,1810-12-03,exact,Monterey,alta,spain,attested/inferred,supply,,port-call?,1,"account of supplies furnished the frigate *Princesa* in the current year — she owes $1,839","[{""type"": ""ca-record"", ""ca"": ""56"", ""doc"": ""387"", ""scan"": ""n336"", ""url"": ""https://archive.org/details/bancarchca_81_18/page/n336""}]",,draft
v0783,(unnamed vessel),,1811-05-30,1811-05-30,exact,San Francisco,alta,,,otter,,port-call?,1,Argüello reports the otter-fishing canoes still working INSIDE the port — up to 50 seen together; six neophytes of the n,"[{""type"": ""ca-record"", ""ca"": ""12"", ""doc"": ""376b"", ""scan"": ""n311–n313"", ""url"": ""https://archive.org/details/168036075_79_14/page/n311""}]",,draft
v0784,suvorov,Suvorov,1811-07-12,1811-07-12,exact,,alta,russia,stated,,,unlocated,1,"Passport/proclamation of the ship *Suvorov* — addressed 'á nuestros buenos amigos y vecinos, los nobles y honrados Españ","[{""type"": ""ca-record"", ""ca"": ""12"", ""doc"": ""479"", ""scan"": ""n403–n406+"", ""url"": ""https://archive.org/details/168036075_79_14/page/n403""}]",,draft
v0785,(unnamed vessel),,1812,1812,exact,Monterey,alta,,,,,port-call?,1,"(top, continuing) 'Que está enterado de papeles sediciosos del Cura Hidalgo y tendrá la vigilancia q.e se le ordena.' 18","[{""type"": ""ca-record"", ""ca"": ""25"", ""doc"": ""42"", ""scan"": ""n380"", ""url"": ""https://archive.org/details/168036074_80_7_2/page/n380""}]",,draft
v0786,(unnamed vessel),,1812-07-31,1812-07-31,exact,,alta,usa,stated,otter,wrecked,unlocated,1,Otter-fishers in SF Bay (June–July): cayucos off San Mateo & by the huichunes/carquines (San Pablo/Carquinez); no ship s,"[{""type"": ""ca-record"", ""ca"": ""12"", ""doc"": ""399"", ""scan"": ""n327–n329"", ""url"": ""https://archive.org/details/168036075_79_14/page/n327""}]",,draft
v0787,(unnamed vessel),,1812-09-07,1812-09-07,exact,,alta,russia,stated,,,unlocated,1,Argüello reports Moraga's second reconnaissance (departed with 4 soldiers 'el 25 del pp.do' [Savage writes Oct.e with an,"[{""type"": ""ca-record"", ""ca"": ""12"", ""doc"": ""401b"", ""scan"": ""n330–n332"", ""url"": ""https://archive.org/details/168036075_79_14/page/n330""}]",,draft
v0788,(unnamed vessel),,1812-11-07,1812-11-07,exact,,alta,,,supply,,unlocated,1,The Mexican Independence war (Morelos) disrupts California's supply line: explains the delays in the *memorias* — shippe,"[{""type"": ""ca-record"", ""ca"": ""17"", ""doc"": ""136"", ""scan"": ""n86–n87"", ""url"": ""https://archive.org/details/168035972_79_19_2/page/n86""}]",,draft
v0789,(unnamed vessel),,1812-12-16,1812-12-16,exact,San Francisco,alta,russia,stated,supply,deserters,port-call?,1,'Establecimiento ruso' — three starving Russian deserters from Kuskov's Fort Ross. A little flag was sighted on the high,"[{""type"": ""ca-record"", ""ca"": ""17"", ""doc"": ""113"", ""scan"": ""n72–n73"", ""url"": ""https://archive.org/details/168035972_79_19_2/page/n72""}]",,draft
v0790,(unnamed vessel),,1813,1813,inferred,,alta,russia,stated,,seized|deserters,unlocated,1,"Sbre 7 (pp.416-21, 10 doc): bando on the wholesale-commerce war contribution; the 3-day compliance-or-dismissal rule for","[{""type"": ""ca-record"", ""ca"": ""25"", ""doc"": ""43"", ""scan"": ""n383"", ""url"": ""https://archive.org/details/168036074_80_7_2/page/n383""}]",,draft
v0791,(unnamed vessel),,1813-02-01,1813-02-01,exact,Monterey,alta,,,warship,arrived,port-call?,1,"1813 Feb.º 1º, San Francisco, Luis Argüello (no dice á quién): vacante una escuadra de su compañía por retiro á inválido","[{""type"": ""ca-record"", ""ca"": ""25"", ""doc"": ""45"", ""scan"": ""n386"", ""url"": ""https://archive.org/details/168036074_80_7_2/page/n386""}]",,draft
v0792,mercury,Mercurio,1813-06-08,1813-06-08,exact,,alta,usa,stated,contraband,seized,unlocated,1,'Captura de fragata *Mercurio*': Arrillaga's order to investigate Noé's prize — reconnoiter the captured Anglo-American ,"[{""type"": ""ca-record"", ""ca"": ""12"", ""doc"": ""423"", ""scan"": ""n358–n359"", ""url"": ""https://archive.org/details/168036075_79_14/page/n358""}]",,draft
v0793,flora,Flora,1813-06-19,1813-06-19,exact,Santa Bárbara,alta,russia,stated,otter,seized,port-call?,1,"THE *MERCURIO*/EAYRS AFFAIR — crew depositions. By Arrillaga's order, José Argüello takes declarations from the Anglo-Am","[{""type"": ""ca-record"", ""ca"": ""12"", ""doc"": ""424"", ""scan"": ""n360–n364"", ""url"": ""https://archive.org/details/168036075_79_14/page/n360""}]",,draft
v0794,mercury,MERCURIO; Mercurio,1813-06-19,1813-06-19,exact,Santa Bárbara,alta,russia,stated,otter,seized,port-call?,2,"THE *MERCURIO*/EAYRS AFFAIR — crew depositions. By Arrillaga's order, José Argüello takes declarations from the Anglo-Am","[{""type"": ""ca-record"", ""ca"": ""12"", ""doc"": ""424"", ""scan"": ""n360–n364"", ""url"": ""https://archive.org/details/168036075_79_14/page/n360""}, {""type"": ""ca-record"", ""ca"": ""12"", ""doc"": ""424"", ""scan"": ""n360–n364"", ""url"": ""https://archive.org/details/168036075_79_14/page/n360""}]",,draft
v0795,flora,Flora,1813-06-20,1813-06-20,exact,,alta,spain,attested/inferred,,,unlocated,1,Aid to the frigate *Flora*: the *gratificación* to be paid if the vecindario must be called up to help.,"[{""type"": ""ca-record"", ""ca"": ""12"", ""doc"": ""421"", ""scan"": ""n357"", ""url"": ""https://archive.org/details/168036075_79_14/page/n357""}]",,draft
v0796,mercury,Mercurio,1813-06-22,1813-06-26,exact,San Pedro,alta,usa,stated,contraband|warship,,port-call?,2,"Per the Governor's order, furnish volunteers to garrison the frigate *Mercurio* (Don Nicolás Noé) from San Pedro to Mont","[{""type"": ""ca-record"", ""ca"": ""12"", ""doc"": ""420"", ""scan"": ""n356–n357"", ""url"": ""https://archive.org/details/168036075_79_14/page/n356""}, {""type"": ""ca-record"", ""ca"": ""12"", ""doc"": ""422"", ""scan"": ""n357–n358"", ""url"": ""https://archive.org/details/168036075_79_14/page/n357""}]",,draft
v0797,flora,Flora,1813-06-26,1813-06-26,exact,San Pedro,alta,usa,stated,contraband|warship,,port-call?,1,'Buque corsario contra los contrabandistas': Capt. Nicolás Noé will leave the *Flora* at San Pedro and prizes at San Die,"[{""type"": ""ca-record"", ""ca"": ""12"", ""doc"": ""422"", ""scan"": ""n357–n358"", ""url"": ""https://archive.org/details/168036075_79_14/page/n357""}]",,draft
v0798,(unnamed vessel),,1813-06-27,1813-06-27,exact,,alta,,,contraband,,unlocated,1,Prize law: how prizes taken from contrabandists are distributed under the Mar del Sur regulation — contraband ship + car,"[{""type"": ""ca-record"", ""ca"": ""12"", ""doc"": ""419"", ""scan"": ""n355–n356"", ""url"": ""https://archive.org/details/168036075_79_14/page/n355""}]",,draft
v0799,americana,Americana,1813-10-14,1813-10-14,exact,Monterey,alta,russia,stated,contraband,seized,port-call?,1,'Sobre remisión de capitán de buque apresado' — de resultas de haberse hecho á la vela con su fragata el capitán Don Nic,"[{""type"": ""ca-record"", ""ca"": ""25"", ""doc"": ""44"", ""scan"": ""n385"", ""url"": ""https://archive.org/details/168036074_80_7_2/page/n385""}]",,draft
v0800,isaac todd,Isaac Todd,1814-03-04,1814-03-04,exact,,alta,britain,stated,,seized|deserters,unlocated,1,(English) Reports desertion of 8 men from the Brit. ship *Isaac Todd*; requests their capture & delivery (with other Bri,"[{""type"": ""ca-record"", ""ca"": ""12"", ""doc"": ""435"", ""scan"": ""n378"", ""url"": ""https://archive.org/details/168036075_79_14/page/n378""}]",,draft
v0801,flora,Flora,1814-04-24,1814-04-24,exact,,alta,spain,stated,,seized,unlocated,1,Legal ruling on the *Mercurio* seizure: the *Flora* could not lawfully seize her as a corsair — exercising the *derecho ,"[{""type"": ""ca-record"", ""ca"": ""12"", ""doc"": ""430"", ""scan"": ""n371"", ""url"": ""https://archive.org/details/168036075_79_14/page/n371""}]",,draft
v0802,mercury,Mercurio,1814-04-24,1814-04-24,exact,,alta,spain,stated,,seized,unlocated,2,Legal ruling on the *Mercurio* seizure: the *Flora* could not lawfully seize her as a corsair — exercising the *derecho ,"[{""type"": ""ca-record"", ""ca"": ""12"", ""doc"": ""430"", ""scan"": ""n371"", ""url"": ""https://archive.org/details/168036075_79_14/page/n371""}, {""type"": ""ca-record"", ""ca"": ""13"", ""doc"": ""102"", ""scan"": ""n96–n97"", ""url"": ""https://archive.org/details/168036075_79_15_2/page/n96""}]",,draft
v0803,(unnamed vessel),,1814-07-30,1814-07-30,exact,San Francisco,alta,russia,stated,,,port-call?,1,Moraga's detailed reconnaissance/defense assessment of the Russian presidio of Ross: difficult approach (artillery can't,"[{""type"": ""ca-record"", ""ca"": ""12"", ""doc"": ""432"", ""scan"": ""n371, n374–n375"", ""url"": ""https://archive.org/details/168036075_79_14/page/n371""}]",,draft
v0804,eagle,Eagle,1814-09-10,1814-09-10,exact,Santa Bárbara,alta,russia,stated,supply,seized,port-call?,1,Capture of the American brig *Pedler* by the Spanish-chartered frigate *Eagle* in the ensenada de San Luis Obispo (26 Au,"[{""type"": ""ca-record"", ""ca"": ""17"", ""doc"": ""163"", ""scan"": ""n106–n109"", ""url"": ""https://archive.org/details/168035972_79_19_2/page/n106""}]",,draft
v0805,maria,María,1814-09-10,1814-09-10,exact,Santa Bárbara,alta,russia,stated,supply,seized,port-call?,1,Capture of the American brig *Pedler* by the Spanish-chartered frigate *Eagle* in the ensenada de San Luis Obispo (26 Au,"[{""type"": ""ca-record"", ""ca"": ""17"", ""doc"": ""163"", ""scan"": ""n106–n109"", ""url"": ""https://archive.org/details/168035972_79_19_2/page/n106""}]",,draft
v0806,pedler,Pedler,1814-09-10,1814-09-10,exact,Santa Bárbara,alta,russia,stated,supply,seized,port-call?,1,Capture of the American brig *Pedler* by the Spanish-chartered frigate *Eagle* in the ensenada de San Luis Obispo (26 Au,"[{""type"": ""ca-record"", ""ca"": ""17"", ""doc"": ""163"", ""scan"": ""n106–n109"", ""url"": ""https://archive.org/details/168035972_79_19_2/page/n106""}]",,draft
v0807,ilmena,Ilmena,1814-10-13,1814-10-13,exact,,alta,russia,stated,,seized,unlocated,1,"'Conducción de presos rusos': the Englishman Don Juan Eliot [John Elliot de Castro] and six more foreigners, captured ab","[{""type"": ""ca-record"", ""ca"": ""12"", ""doc"": ""427"", ""scan"": ""n368–n369"", ""url"": ""https://archive.org/details/168036075_79_14/page/n368""}]",,draft
v0808,mercury,Mercurio,1814-10-30,1814-10-30,exact,,alta,spain,stated,,seized,unlocated,1,"Provisioning costs of the *Mercurio* prisoners: per the Consejo de Presidios order (18 Sep 1813), the Habilitación suppo","[{""type"": ""ca-record"", ""ca"": ""12"", ""doc"": ""428"", ""scan"": ""n369–n370"", ""url"": ""https://archive.org/details/168036075_79_14/page/n369""}]",,draft
v0809,tagle,Tagle,1814-10-30,1814-10-30,exact,,alta,spain,stated,,seized,unlocated,1,"Provisioning costs of the *Mercurio* prisoners: per the Consejo de Presidios order (18 Sep 1813), the Habilitación suppo","[{""type"": ""ca-record"", ""ca"": ""12"", ""doc"": ""428"", ""scan"": ""n369–n370"", ""url"": ""https://archive.org/details/168036075_79_14/page/n369""}]",,draft
v0810,(unnamed vessel),,1815,1815,year,,alta,britain,stated,,,unlocated,1,Re the British schooner from the Columbia and the protest of the agent of the North West Company of Canada ('Compañía de,"[{""type"": ""ca-record"", ""ca"": ""12"", ""doc"": ""456"", ""scan"": ""n387–n388"", ""url"": ""https://archive.org/details/168036075_79_14/page/n387""}]",,draft
v0811,bordelais,Bordelais,1815,1815,inferred,Monterey,alta,russia,stated,otter|supply,deserters|arrived,port-call?,1,SECOND *borrador* register of Solá's outgoing orders (1815–17) — the volume's richest Russian/foreign-relations stretch.,"[{""type"": ""ca-record"", ""ca"": ""17"", ""doc"": ""188"", ""scan"": ""n143–n152"", ""url"": ""https://archive.org/details/168035972_79_19_2/page/n143""}]",,draft
v0812,chirikov,Chirikov,1815,1815,inferred,Monterey,alta,russia,stated,otter|supply,deserters|arrived,port-call?,1,SECOND *borrador* register of Solá's outgoing orders (1815–17) — the volume's richest Russian/foreign-relations stretch.,"[{""type"": ""ca-record"", ""ca"": ""17"", ""doc"": ""188"", ""scan"": ""n143–n152"", ""url"": ""https://archive.org/details/168035972_79_19_2/page/n143""}]",,draft
v0813,columbia,Columbia,1815,1815-07-08,mixed,Monterey,alta,usa,stated,contraband|supply,deserters|seized|arrived,port-call?,2,Dictamen prohibiting commerce with English ships re the English schooner *Columbia* at Monterey & the North West Company,"[{""type"": ""ca-record"", ""ca"": ""12"", ""doc"": ""474"", ""scan"": ""n397–n399"", ""url"": ""https://archive.org/details/168036075_79_14/page/n397""}, {""type"": ""ca-record"", ""ca"": ""25"", ""doc"": ""46"", ""scan"": ""n387"", ""url"": ""https://archive.org/details/168036074_80_7_2/page/n387""}]",,draft
v0814,cossack,Cossack,1815,1815,inferred,Monterey,alta,usa,stated,whaler|warship,,port-call?,1,Long *borrador* register of Solá's outgoing letters/orders (1815–1822) — a major composite source. 1815–17 highlights: ⭐,"[{""type"": ""ca-record"", ""ca"": ""17"", ""doc"": ""177"", ""scan"": ""n117–n138"", ""url"": ""https://archive.org/details/168035972_79_19_2/page/n117""}]",,draft
v0815,eagle,Eagle,1815,1815,inferred,Monterey,alta,usa,stated,whaler|warship,,port-call?,1,Long *borrador* register of Solá's outgoing letters/orders (1815–1822) — a major composite source. 1815–17 highlights: ⭐,"[{""type"": ""ca-record"", ""ca"": ""17"", ""doc"": ""177"", ""scan"": ""n117–n138"", ""url"": ""https://archive.org/details/168035972_79_19_2/page/n117""}]",,draft
v0816,paz y religion,Paz y Religión,1815,1815,inferred,Monterey,alta,usa,stated,whaler|warship,,port-call?,1,Long *borrador* register of Solá's outgoing letters/orders (1815–1822) — a major composite source. 1815–17 highlights: ⭐,"[{""type"": ""ca-record"", ""ca"": ""17"", ""doc"": ""177"", ""scan"": ""n117–n138"", ""url"": ""https://archive.org/details/168035972_79_19_2/page/n117""}]",,draft
v0817,pedlar,Pedlar,1815,1815,year,,alta,usa,stated,,seized,unlocated,2,Cluster: (May 8) query re the late Arrillaga & the six-presidio Habilitación accounts; (May 9) approved licensing the Am,"[{""type"": ""ca-record"", ""ca"": ""12"", ""doc"": ""471"", ""scan"": ""n393"", ""url"": ""https://archive.org/details/168036075_79_14/page/n393""}, {""type"": ""ca-record"", ""ca"": ""12"", ""doc"": ""472"", ""scan"": ""n394"", ""url"": ""https://archive.org/details/168036075_79_14/page/n394""}]",,draft
v0818,reina de los angeles,Reina de los Ángeles,1815,1815,inferred,Monterey,alta,usa,stated,whaler|warship,,port-call?,1,Long *borrador* register of Solá's outgoing letters/orders (1815–1822) — a major composite source. 1815–17 highlights: ⭐,"[{""type"": ""ca-record"", ""ca"": ""17"", ""doc"": ""177"", ""scan"": ""n117–n138"", ""url"": ""https://archive.org/details/168035972_79_19_2/page/n117""}]",,draft
v0819,rurik,Rurik,1815,1815,inferred,Monterey,alta,russia,stated,otter|supply,deserters|arrived,port-call?,1,SECOND *borrador* register of Solá's outgoing orders (1815–17) — the volume's richest Russian/foreign-relations stretch.,"[{""type"": ""ca-record"", ""ca"": ""17"", ""doc"": ""188"", ""scan"": ""n143–n152"", ""url"": ""https://archive.org/details/168035972_79_19_2/page/n143""}]",,draft
v0820,san carlos,San Carlos,1815,1815,inferred,Monterey,alta,usa,stated,whaler|warship,,port-call?,1,Long *borrador* register of Solá's outgoing letters/orders (1815–1822) — a major composite source. 1815–17 highlights: ⭐,"[{""type"": ""ca-record"", ""ca"": ""17"", ""doc"": ""177"", ""scan"": ""n117–n138"", ""url"": ""https://archive.org/details/168035972_79_19_2/page/n117""}]",,draft
v0821,suvorov,Suvorov,1815,1815,inferred,Monterey,alta,russia,stated,otter|supply,deserters|arrived,port-call?,1,SECOND *borrador* register of Solá's outgoing orders (1815–17) — the volume's richest Russian/foreign-relations stretch.,"[{""type"": ""ca-record"", ""ca"": ""17"", ""doc"": ""188"", ""scan"": ""n143–n152"", ""url"": ""https://archive.org/details/168035972_79_19_2/page/n143""}]",,draft
v0822,tagle,Tagle,1815,1815,year,,alta,usa,stated,,seized,unlocated,1,Cluster: (May 8) query re the late Arrillaga & the six-presidio Habilitación accounts; (May 9) approved licensing the Am,"[{""type"": ""ca-record"", ""ca"": ""12"", ""doc"": ""471"", ""scan"": ""n393"", ""url"": ""https://archive.org/details/168036075_79_14/page/n393""}]",,draft
v0823,mercury,Mercurio,1815-02-20,1815-02-20,exact,,alta,spain,stated,,seized,unlocated,1,"Legal dictamen on the *Mercurio*: re Eayrs (owner, seized in the SB Channel by Noé); provisioning for him + family + 4 s","[{""type"": ""ca-record"", ""ca"": ""12"", ""doc"": ""448"", ""scan"": ""n384"", ""url"": ""https://archive.org/details/168036075_79_14/page/n384""}]",,draft
v0824,(unnamed vessel),,1815-03-06,1815-03-06,exact,,alta,,,,,unlocated,1,"Dictamen: provision Eayrs, sell the corvette, and take the declaration of Francisco Mira[?].","[{""type"": ""ca-record"", ""ca"": ""12"", ""doc"": ""449"", ""scan"": ""n385"", ""url"": ""https://archive.org/details/168036075_79_14/page/n385""}]",,draft
v0825,mercury,Mercurio,1815-03-08,1815-03-08,exact,,alta,usa,attested/inferred,,seized,unlocated,1,"Per the reports, acted on provisioning Jorge Hayes [Eayrs] & holding the corvette *Mercurio* pending the Govt's ruling o","[{""type"": ""ca-record"", ""ca"": ""12"", ""doc"": ""447"", ""scan"": ""n384"", ""url"": ""https://archive.org/details/168036075_79_14/page/n384""}]",,draft
v0826,mercury,Mercurio,1815-03-08,1815-03-08,exact,Fort Ross,alta,usa,attested/inferred,,,port-call?,1,Certified copy of the *Mercurio* dictamen (cross-ref tomo p. 374). [dup],"[{""type"": ""ca-record"", ""ca"": ""12"", ""doc"": ""451"", ""scan"": ""n385"", ""url"": ""https://archive.org/details/168036075_79_14/page/n385""}]",,draft
v0827,rurik,Rurik,1815-06-27,1815-06-27,exact,,alta,russia,attested/inferred,,,unlocated,1,"The royal order behind the *Rurik* hospitality (Lardizábal, Madrid 27 Jun 1815): Spanish authorities in both Americas to","[{""type"": ""ca-record"", ""ca"": ""13"", ""doc"": ""172"", ""scan"": ""n139–n140"", ""url"": ""https://archive.org/details/168036075_79_15_2/page/n139""}]",,draft
v0828,atala,Atala,1815-07-15,1815-07-15,exact,,alta,usa,stated,,,unlocated,1,Passport of the ship *Atala* (American) issued by the Collector of Customs at Boston; Savage's translation largely illeg,"[{""type"": ""ca-record"", ""ca"": ""12"", ""doc"": ""208"", ""scan"": ""n189–n192"", ""url"": ""https://archive.org/details/168036075_79_14/page/n189""}]",,draft
v0829,sarrasoff,Sarrasoff,1815-08-21,1815-08-21,exact,,alta,russia,stated,,,unlocated,1,The Russian ship 'Sarrasoff' [*Suvorov*] arrived the 20th requesting water/wood/provisions (promised); commander Lazaref,"[{""type"": ""ca-record"", ""ca"": ""12"", ""doc"": ""478"", ""scan"": ""n402–n403"", ""url"": ""https://archive.org/details/168036075_79_14/page/n402""}]",,draft
v0830,suvorov,Suvorov,1815-08-21,1815-08-21,exact,,alta,russia,stated,,,unlocated,1,The Russian ship 'Sarrasoff' [*Suvorov*] arrived the 20th requesting water/wood/provisions (promised); commander Lazaref,"[{""type"": ""ca-record"", ""ca"": ""12"", ""doc"": ""478"", ""scan"": ""n402–n403"", ""url"": ""https://archive.org/details/168036075_79_14/page/n402""}]",,draft
v0831,rurik,Rurik,1815-09-16,1815-09-16,exact,,alta,russia,stated,,,unlocated,1,"Spanish passport/safe-conduct for the *Rurik*, issued by Don Carlos Gutiérrez de los Ríos, Conde de Fernán Núñez, duque ","[{""type"": ""ca-record"", ""ca"": ""13"", ""doc"": ""171"", ""scan"": ""n137–n139"", ""url"": ""https://archive.org/details/168036075_79_15_2/page/n137""}]",,draft
v0832,(unnamed vessel),,1815-09-30,1815-09-30,exact,Bodega,alta,russia,stated,,,port-call?,1,'Comercio con los rusos': among the Ross boats arriving from Bodega came a 130-ton schooner that supplied goods to the t,"[{""type"": ""ca-record"", ""ca"": ""12"", ""doc"": ""453"", ""scan"": ""n386"", ""url"": ""https://archive.org/details/168036075_79_14/page/n386""}]",,draft
v0833,(unnamed vessel),,1815-10-02,1815-10-02,exact,,alta,russia,stated,,departed,unlocated,1,"Interrogation of the brig's crew: ① Benjamin Ingraham, pilot, American (New York): arrived San Luis for water/weather, t","[{""type"": ""ca-record"", ""ca"": ""12"", ""doc"": ""473"", ""scan"": ""n394+"", ""url"": ""https://archive.org/details/168036075_79_14/page/n394""}]",,draft
v0834,ilmena,Ilmena,1815-10-02,1815-10-02,exact,Sitka,alta,russia,stated,otter,,port-call?,1,Ingraham concl.: Baranov ('Coscoff/Beranoff') styles himself Governor of Sitka; Ingraham knows Benjamin Tarasoff & John ,"[{""type"": ""ca-record"", ""ca"": ""12"", ""doc"": ""473"", ""scan"": ""n395–n397"", ""url"": ""https://archive.org/details/168036075_79_14/page/n395""}]",,draft
v0835,ilmena,Ilmena,1815-10-05,1815-10-05,exact,,alta,,,,seized,unlocated,1,"Remits 22 captured individuals + the 'Patrón Ferreof/Boris' [*Ilmena* crew], guarded by vecinos & soldiers (only one wit","[{""type"": ""ca-record"", ""ca"": ""12"", ""doc"": ""466"", ""scan"": ""n391–n392"", ""url"": ""https://archive.org/details/168036075_79_14/page/n391""}]",,draft
v0836,paz y religion,Paz y Religión,1815-10-05,1815-10-05,exact,,alta,spain,attested/inferred,,,unlocated,1,'Toma de posesión de gobierno político y militar': Solá notifies his appointment by Viceroy Calleja (31 Dec 1814) as Gov,"[{""type"": ""ca-record"", ""ca"": ""12"", ""doc"": ""443"", ""scan"": ""n382"", ""url"": ""https://archive.org/details/168036075_79_14/page/n382""}]",,draft
v0837,(unnamed vessel),,1815-10-14,1815-10-14,exact,,alta,,,,,unlocated,1,"Habilitado General to be named at Guadalajara; the $1,000 salary + $500 transport unresolved.","[{""type"": ""ca-record"", ""ca"": ""12"", ""doc"": ""461"", ""scan"": ""n390"", ""url"": ""https://archive.org/details/168036075_79_14/page/n390""}]",,draft
v0838,ilmena,Ilmena,1815-10-15,1815-10-15,exact,Monterey,alta,russia,stated,otter,seized|refused,port-call?,1,"'Respuestas de Boris' — the interrogation of the captured Russian otter-hunter. He is Boris Tarasov, sailor, Russian of ","[{""type"": ""ca-record"", ""ca"": ""17"", ""doc"": ""192"", ""scan"": ""n153–n154"", ""url"": ""https://archive.org/details/168035972_79_19_2/page/n153""}]",,draft
v0839,(unnamed vessel),,1815-10-18,1815-10-18,exact,,alta,,,,,unlocated,1,Asked Padre Zalvidea for 50 Indians to transport the cayuques.,"[{""type"": ""ca-record"", ""ca"": ""12"", ""doc"": ""468"", ""scan"": ""n392"", ""url"": ""https://archive.org/details/168036075_79_14/page/n392""}]",,draft
